{
  "schema_version": 1,
  "policy_id": "OTIS_ADAPTIVE_HYBRID_REGULATION_V1",
  "status": "selected_production_policy",
  "oscillator_identity": "CX317",
  "bindings": {
    "response_classification": "profiles/discipline/response_classification_v1.json",
    "frequency_estimator": "profiles/estimators/pps_gated_frequency_estimator_v1.json",
    "phase_estimator": "profiles/estimators/relative_phase_estimator_v1.json",
    "plant_model": "profiles/plant_models/pps_gated_oscillator_plant_v1.json"
  },
  "frequency_control": {
    "policy_id": "OTIS_FREQUENCY_CONTROL_POLICY_V1",
    "status": "selected_production_component",
    "frequency_estimator_id": "OTIS_PPS_GATED_FREQUENCY_ESTIMATOR_V1",
    "parameters": {
      "nominal_frequency_hz": 10000000,
      "gain_min_hz_per_code": 0.00016357422282453626,
      "gain_nominal_hz_per_code": 0.00017008467693813145,
      "gain_max_hz_per_code": 0.00017334010044578463,
      "estimator_span_s": 600,
      "minimum_applied_cadence_s": 1800,
      "settling_exclusion_s": 900,
      "fresh_support_after_settling_s": 600,
      "startup_warmup_s": 1800,
      "error_deadband_hz": 0.006249995628992717,
      "integrator_gain_codes_per_hz_per_decision": 2884.5027706464516,
      "maximum_update_codes": 21,
      "dac_min_code": 43008,
      "dac_max_code": 43776
    },
    "authority": {
      "arming_required": false,
      "one_request_outstanding": true,
      "automatic_retry": false,
      "automatic_restore": false,
      "gnss_qualification_required": true,
      "D14_reference_required": true,
      "D8_count_required": true,
      "D10_external_event_excluded": true
    }
  },
  "topology": {
    "reference_input": "D14_authoritative_PPS",
    "oscillator_count_input": "D8_authoritative_oscillator_count",
    "forwarded_output": "D9_zero_control_authority",
    "diagnostic_monitor": "D6_fail_local_zero_control_authority",
    "external_event_input": "D10_optional_EVT_zero_reference_and_control_authority",
    "gnss_role": "qualification_metadata_from_same_receiver_as_D14_never_timing_authority",
    "gnss_baud": 115200,
    "serial_owner_count": 1
  },
  "maintenance_selection": {
    "requires_tight_state": "TIGHT_INSIDE",
    "requires_phase_material_decision": false,
    "selected_frequency_estimator": "OTIS_PPS_GATED_FREQUENCY_ESTIMATOR_V1",
    "window_s": 600,
    "frontier_support": "(opening_closing]",
    "contiguous_frontier": "next_opening_eq_prior_closing",
    "overlap_frontier": "next_opening_lt_prior_closing",
    "gap_frontier": "next_opening_gt_prior_closing",
    "required_consecutive_same_sign_windows": 2,
    "same_identity_fields": [
      "capture_session",
      "applied_code",
      "dac_epoch",
      "phase_epoch_and_validity",
      "selected_estimator_identity"
    ]
  },
  "maintenance_arithmetic": {
    "frequency_centre_units": "-36*accumulated_edge_error_counts",
    "phase_centre_units": "clamp(-relative_phase_cycles,-36,+36)",
    "combined_centre_units": "frequency_centre_units+phase_centre_units",
    "unit_hz": "1/21600",
    "closed_interval_half_width_units": 18,
    "strict_sign": "positive_if_lower_gt_0_negative_if_upper_lt_0_otherwise_zero_containing",
    "conservative_maximum_plant_gain_hz_per_code": "173340101/1000000000000",
    "no_zero_cross_cap": "floor(nearest_zero_interval_units*1000000000000/(21600*173340101))",
    "maximum_step_codes": 21,
    "rounding": "half_away_from_zero",
    "authoritative_fixed_point_unit": "signed_integer_picocode_1e_minus_12_code",
    "picocode_reduced_numerator": 625000000000000000000,
    "picocode_reduced_denominator": 4680182727,
    "conversion": "checked_signed_128_bit_quotient_remainder",
    "maximum_absolute_combined_centre_units": 332041393326771929124
  },
  "correction_debt": {
    "enabled": true,
    "maximum_absolute_total_picocodes": 500000000000,
    "component_tags": [
      "FLL",
      "PLL"
    ],
    "commit": "only_after_exact_acceptance_application_code_epoch_and_first_dependent_consumer",
    "tag_allocation": "magnitude_weighted_by_current_raw_component_plus_prior_same_component_debt_with_PLL_as_exact_remainder",
    "preserve_without_accrual": [
      "persistence_hold",
      "cadence_hold",
      "source_overlap",
      "source_gap_restart",
      "settling_hold",
      "reference_or_metadata_hold",
      "request_rejection_or_expiry",
      "response_pending_or_completion"
    ],
    "reset_both": [
      "zero_containing_or_opposite_interval",
      "phase_material_or_outside_tight_ordinary_path",
      "capture_session_or_selected_estimator_change",
      "new_policy_activation"
    ],
    "phase_loss_or_epoch_change": "preserve_FLL_discard_PLL",
    "unknown_or_incomplete_application": "fail_static"
  },
  "gnss_metadata_hold": {
    "recoverable_serial_metadata_anomaly": "hold_new_correction_preserve_last_confirmed_code_and_D14_D8_capture",
    "no_forced_glitch": true,
    "debt": "freeze_without_accrual",
    "requalification": "fresh_same_receiver_metadata_then_two_complete_causally_later_maintenance_windows",
    "run_terminal": false
  },
  "global_authority_limits": {
    "maximum_automatic_applications": 0,
    "maximum_cumulative_absolute_movement_codes": 0,
    "maximum_combined_step_codes": 21,
    "minimum_applied_cadence_s": 1800,
    "minimum_code": 43008,
    "maximum_code": 43776,
    "maximum_outstanding_requests": 1,
    "automatic_retry": false,
    "automatic_restoration": false
  },
  "repeated_alternation": {
    "predicate": "latest_three_applied_directions_and_nonzero_prospective_direction_reverse_three_times",
    "authority": "diagnostic_only",
    "recording": "request_reason_suffix_repeated_alternation"
  },
  "failure_isolation": {
    "D10_absence_noise_invalidity_or_overflow": "degrade_external_event_evidence_only",
    "D6_failure": "degrade_diagnostic_monitor_only",
    "D9_failure": "forwarded_output_fault_without_timing_authority",
    "host_discrepancy": "review_hold_preserve_capture_and_last_confirmed_code",
    "shared_D14_D8_fault": "fail_static"
  },
  "claims_not_made": [
    "calibrated_absolute_frequency_accuracy",
    "UTC_or_absolute_time_accuracy",
    "cross_phase_epoch_continuity",
    "D10_reference_or_control_authority"
  ],
  "startup_code": 43085
}
